꼰대책방,"청계천에서 헌책 수리공으로 유명했다는 송가 아재는 낡은 책을 접착제와 물풀, 양면테이프, 그리고 신용 카드 한 장으로 새 책처럼 만드는 장인이었다. 조각조각 떨어진 제본은 타카 몇 방에 다시 단단히 뭉쳤고, 벌어진 표지는 얇은 양면테이프로 내지와 해후했다. 코팅이 벗겨져 색이 바랜 표지 일러스트는 투명 매니큐어와 네일 드라이어를 몇 번 오가며 한결 선명해졌다. 세월을 감당하느라 누래진 내지의 옆면을 파우더 팩트로 하얗게 변신시키자 책은 세상에 처음 나왔을 때의 긴장감을 그대로 간직한 듯 정갈해졌다.  접기"
버려진 우주선의 시간,"P. 9~10  “그 숫자들은 뭐였지?”그녀가 보았다. 25년 7일 14시간. 그건 훈이 나를, 토성을 떠난 후 지나가버린 시간들이었다."
버려진 우주선의 시간,P. 13  내 이름은 룻. 지구에서 햄버거를 팔고 있다. 그 유명한 ‘버거버거’를 다들 한번쯤 들어봤을 것이다. 전 우주에 체인점을 두고 있는 햄버거 전문 기업. 바로 거기서 낮 타임에 아르바이트를 뛰고 있다.해가 지고 나면 뭘 하는지는 조금 뒤에 가서 털어놓도록 하겠다. 좌우지간 나는 할아버지가 생각하던 것처럼 그렇게 순진한 어린아이는 아니었다. 요즘에 와서야 그분이 유난스럽게 구셨던 이유를 알 것도 같았다. 반평생 수많은 우주의 범죄를 목격하신 분이었으니 그럴 만도 했다.  접기
버려진 우주선의 시간,"P. 60  이런 식의 복수는 사실 훈에게 해주려고 했다. 그가 다시 날 찾아오면, 무전도 받지 않고 원래 있던 자리에서 사라진 다음, 버려진 느낌이 어떤 건지 알게 해주는 것…….인간들은 속 시원한 앙갚음을 해주고 나면 ‘고소하다’라고 말한다. 하지만 그런 느낌은 조금도 들지 않았고, 더러운 찌꺼기가 가슴 깊은 곳에 가라앉은 것 같은 찜찜함만 남았다. 뭐가 잘못된 거지. 대상이 훈이 아니라 그의 손녀라서? 아니면 내가 로봇이라 인간과는 다르게 감지하는 걸까?  접기"
버려진 우주선의 시간,"P. 69  “그 만화는 명작이라고! 또 물어볼까 봐서 미리 얘기하는데, 명작이란 건 시간이 흘러도 변함이 없는 것을 말해.”그래. 시간이 흘러도 변함이 없는 것들이 있다. 변함없이 헛된 것을 좇는 범죄자들이 있고, 그런 놈들에게 어이없이 쫓기는 사람이 있고, 또 그 범죄자들을 쫓는 사람이 있고……."
버려진 우주선의 시간,"P. 107  우리는 배를 불려주고 감옥에 가두지 않은 것에 대해 감사한 마음은 품고 있었지만, 일찍부터 자리 잡은 모순된 자존심이 그녀의 따듯한 동정심을 강하게 거부했다.인간이 유통기한이 지난 음식쓰레기보다 빨리 처리해야 하는 게 있다면, 그건 바로 그런 종류의 자존심이다. 올바른 자존심도 분명히 있지. 하지만 다른 사람이 나보다 현명할 수 있다는 걸 인정하지 않는 건 어리석은 짓이야. 그때는 미처 몰랐어.  접기"
버려진 우주선의 시간,"P. 123  호럼에게는 인간이 시간을 만들 수 있다고 말해준 사람이 없었던 건지도 모른다. 설사 그런 말을 해준 사람이 곁에 있었다 해도, 내가 온 마음으로 뜨겁게 받아들인 깨달음이 누군가에겐 그저 휘파람 소리에 불과할 수도 있다는 것을 받아들여야 했다.인간의 언어는 별들의 중력과도 같다. 사람들은 수많은 타인과 부딪치며 여러 언어의 세계를 자신의 것으로 통합해나간다. 다양한 언어가 뭉칠수록 끌어당기는 힘도 덩달아 강해진다.  접기"
다이웰 주식회사,"P. 16~17  세상에서 가장 존엄한 죽음을 맞게 될 당신, 힘겨운 오늘보다 고통 없는 내일을 꿈꾸는 당신, 우리는 그런 당신을 위해 당신의 죽음을 연구합니다. 당신의 죽음에 필요한 것이 무엇인지 고민합니다. 이곳은 저소득층 노인을 위한 국립존엄보장센터입니다.- 국립존엄보장센터"
다이웰 주식회사,P. 20  오늘은 내 인생의 마지막 날이다. 아름다운 것만 보기에도 시간은 턱없이 부족하다.- 국립존엄보장센터
다이웰 주식회사,"P. 23  생존세가 뭔지……. 저 젊었을 때부터 저출생 고령화 문제가 심각하긴 했지만, 돈이 없다고 죽어야 하는 세상이 올 줄은 몰랐습니다그려.- 국립존엄보장센터"
다이웰 주식회사,P. 43  회사가 집에서 가깝다는 사실은 매운 낙지집에서 주는 박하사탕 정도의 위안거리였다.- 다이웰 주식회사
다이웰 주식회사,"P. 43  차창으로 보이는 서강대교의 난간과, 그 밑으로 흐르는 한강을 보며 언젠가는 저 위에서 다이빙할 거란 생각을 하면 울렁이는 속이 조금은 진정되었다. 다이빙 포인트는 P19 지점이 될 것이다. 별다른 이유는 없었다. 딱히 19라는 숫자를 좋아하는 것도 아니고, 그냥 그즈음이 좋을 것 같았다. - 다이웰 주식회사"
다이웰 주식회사,P. 46  산 자와 죽은 자의 경계에 있는 감염자를 위해 멀쩡한 이들이 기울이는 관심이란 표면적이거나 일시적인 것에 불과했다.- 다이웰 주식회사
다이웰 주식회사,"P. 56  이천만원, 누구에게는 코트 한 벌 값이겠지만, 김영호 씨나 나 같은 사람에게는 일 년 치 생활비를 훌쩍 넘는 돈이었다.- 다이웰 주식회사"
다이웰 주식회사,"P. 65  하지만 엄마는 아직 죽지 않았다. 엄마는 자신이 가장 혐오하던 몰골로, 살아 있지만 살아 있지 않은 형태로 삶이 끝나기를 기다리고 있다.- 다이웰 주식회사"
다이웰 주식회사,"P. 85  “낙태하러 왔는데요.” 나는 되도록 담담하게 말했다. 이비인후과에 가서 편도선이 부었는데요,라고 말하던 느낌을 되살려서.- 하나의 미래"
다이웰 주식회사,"P. 89~90  그런 차림으로 밖에 나오다니, 자살하려고 한 건가요?” 여자는 나를 비난하는 어조로 물었다. “네?”낙태는 하려 했지만 자살 따위는 꿈에도 생각하지 않았다.- 하나의 미래"
물 그림 엄마,P. 10  “그러나 반복되어 익숙해지는 기적은 기적일 수 없었다. 엄마가 세 번쯤 살아나자 고비를 넘기셨습니다 하는 의사들의 목소리에 차츰 권태가 꼈다. 이건 기적입니다라고 더 이상 누구도 말하지 않았다.”
물 그림 엄마,P. 78  그건 일종의 생존 확인이었다. 밤새 안녕을 확인하는 일. 혼자 죽는 것보다 죽었는데 아무도 모르는 게 더 두려운 마음은 이해가 됐다. 그렇지만 저승 문을 업고 다닐 나이에 그렇게 뻔질나게 고하는 안녕이라니. 좀 징글징글한 느낌도 들었다.”
물 그림 엄마,"P. 110  “할머니와 나는 오랫동안 서로를 미워하거나 구박하거나 증오했다. 그런데도 결국 이렇게 둘만 남았다. 우리는 서로 미워했지만, 다른 사람은 우리에게 아예 무관심했다.”"
물 그림 엄마,"P. 129  “처음 그 이야기를 듣던 날 나는 마음부터 몸까지 모두 덜덜덜 떨었다. 지어 낸 이야기여도 무서웠고, 사실이라면 더더욱 무서웠다. 혹시라도 내 심장에서 두 개의 심장이 쿵쿵거리는 걸 듣게 될까 봐 잘 때라도 가슴에 손을 올리지 못했다. 그러면서도 가끔은 그 이야기가 사실 같았다. 사실이었으면 싶기도 했다. 여전히 무서웠지만 그런 일이 실제로 가능하다고 상상하면 한편으로는 놀랍고, 신비하고, 경이롭고, 황홀했다. 그러면 그게 진실이 아닌가 싶었다.”  접기"
물 그림 엄마,"P. 162  “아이를 사랑했다. 그러나 도망치고 싶기도 했다. 어느 쪽이 진심일까. 잠들고 싶지만 잠들기 두려운 날 같은, 그런 사랑이 있다는 걸 어떻게 설명해야 할까.”"
물 그림 엄마,P. 234  “눈물은 나지 않았다. 슬프지도 않았다. 그저 좀 이상했다. 죽어서 다시 만난 사람과 또 헤어질 수도 있다는 생각은 한 번도 해 본 적 없었다. 죽은 사람과 만나서 극장을 가고 여행을 다니는 일보다 헤어지는 일이 더 이상했다.”
SF 김승옥,"P. 23~24  50년 후, 디파이 나인의 기자의 어느 날 / 김승옥‘D?9’은 취재용 무선 전화기를 어깨에 메고, 팩시밀리에서 경쟁지의 사회면 몇 장을 찍어내 돌돌 말아들고 집을 나선다. 맨 아래층에 있는 진료실에 들러 간호원의 도움을 받으며 자동진찰기에 건강상태를 알아본다. 심전, 뇌파 등등 별로 이상이 없다는 카드를 자동진찰기는 토해낸다.   “괜찮은데요 뭘.”일흔 다섯 살인 간호원은 카드를 들여다보고 나서 묻는다.  “무슨 꿈을 꾸었는데?”‘D?9’은 꿈 얘기를 대강만 해준다. 간호원은 열심히 듣고나서,   “우리가 젊었을 땐, 아이 꿈을 꾸면 좋지 않은 일이 생긴다고 했는데......   그렇지만 요즘 세상에서 나쁜 일이 있다고 그게 얼마나 나쁘겠수. 불안해할 거 없어요.“그러나 현대라고 나쁜 일이 없는 건 아니다. 물론 직장으로부터의 해고 따위가 나쁠 건 없다. 그는 레이저광선 취급 면허도 가지고 있으니 하다못해 수마트라에 가서 벌목꾼 노릇이라도 할 수 있다. 그럼에도 불구하고 나쁜 일이란 있는 것이다. 가령......가령......? 그러고 보니 간호원의 말이 맞는 것도 같다. 그래, 나쁜 일이란 별로 없군. 죽는다는 걸 제외하곤 말이야. 죽음, 그것은 과연 나쁜 일이다. 나도 죽게 될까?  접기"
SF 김승옥,"P. 37  중세 소설 / 김학찬중세인들은 컴퓨터를 두려워했습니다. 납득하기 어렵습니다만, 자신들이 제작한 것 따위에 공포를 느낀다니 자의식 과잉이라고 불러야 할까요, 자의식 부족이라고 여겨야 할까요. 우리가 잘 아는 갈등 덕분에 중세는 끝났습니다. 네, 나그네쥐 떼들이 일제히 바다를 향해 달려가 차례로 집단 자살을 하는 것과 같은 일이 일어났습니다. 우리가 배운 역사 그대로, 무지 때문입니다. 중세인들은 진짜와 가짜를 구분할 줄 몰랐습니다. 999년, 1999년 하는 식으로 그저 순차적인 숫자에서도 종말을 느꼈던 인간들이었습니다. 상상력 때문입니다. 태어난 날짜를 기념하는 관습도 있었고, 인간이 죽으면 특별한 의식을 치르기도 했습니다. 모여서 음식을 나눠 먹거나 노래를 부르며 망자가 가는 곳에 대한 이야기를 나누었다고 합니다. 모이는 것은, 죽음을 생각하는 것은, 쓸데없고 위험하기만 한 행동입니다. 굳이 왜 모여서 전염의 위험을 감수합니까. 죽음 이후를 생각한다고 해서 무엇이 달라집니까. 울면서 고통을 자처할 필요가 있습니까. 기뻐하거나 슬퍼한다고 나아지는 게 있겠습니까.  접기"
SF 김승옥,"P. 64~65  시에스타 / 윤이안나의 엄마, 그러니까 나를 낳아준 모체는 이시스인이었다. 당시만 해도 지구가 멀쩡히 제 기능을 하던 때였고, 대부분의 행성인들은 지구인 모르게 지구 여행을 다녀오곤 했다. 불쌍한 우리 아버지는 지구에 놀러온 이스스인에게 속아 사기 결혼을 당한 것이다. 딱히 아버지를 사랑해서 결혼한 것 같지는 않다. 이시스인답지 않게 호기심이 넘쳤던 엄마는 알려지지 않은 행성을 찾아다니는 여행을 즐겼고, 그 와중에 발견한 지구를 꽤 마음에 들어 했다. 지구인들이 하는 짓이 바보 같긴 하지만 재미있는 점도 있다고 낄낄거릴 때도 있었다. 하지만 기본적으로 자식에 대한 애정은 없었다. 그리하여 열네 살쯤 나이를 먹고 나서는 나도 썩 그럴듯한 방식으로 내 존재의 이유를 설명할 수 있게 되었다.   “엄마는 그냥 궁금했던 거야. 지구인과 아이를 낳으면 그 아이는 지구인이 될까, 나처럼 될까.”엄마는 부정하지 않았고 불행하게도 나는 지구인의 특성을 훨씬 더 많이 갖고 태어났다. 어릴 때는 그래서 어쩌면 내가 엄마의 실패작이 아닐까, 오래 고민해야 했다.  접기"
SF 김승옥,"P. 109~110  준 / SOOJA아이는 예정대로 정시에 나왔다. 간호사가 아주 예쁜 아기라고 말하며 오메가를 준에게 건넸다. 간호사는 준과 오메가를 번갈아 도며 무언가 찾는 눈치였지만 이내 그만두었다. 준은 푹신한 포대기에 싸여 새록새록 잠들어 있는 오메가를 찬찬히 바라보았다. 준은 처음 맞닥뜨린 상황에 어떤 감정을 느껴야할지 잠시 생각했다. 특정한 하나의 감정이라기보다는 수많은 감정이 동시에 전해졌다. 준은 자신의 회로 작용으로 그 느낌이 생긴 것인지 외부에서 전달된 뇌의 패턴에 따라 그렇게 느껴지도록 된 것인지 알 수 없었다. 하지만 분명 준에게는 새로운 감정이 또 하나 새겨졌다. 그건 어쩌면 수백만 년 인류의 유전자 속에 새겨진 기억이었다. 준의 뺨에는 2% 염도의 눈물이 흘렀다. 준의 입술로 흘러든 눈물은 평소보다 좀 더 짜게 느껴졌다. 눈물의 농도가 짙어진 건 기쁨 때문일까, 슬픔 때문일까 아니면 노여움 때문일까, 안타까움 때문일까. 아주 잠시 준은 고민했다.  접기"
SF 김승옥,"P. 116  로그아웃월드 / 박생강파주 국제도시를 둘러싼 괴담들은 결코 사라지지 않았다. 그리고 동구는 그 괴담 중에 하나를 귀요미 뒷좌석에서 사실로 확인했다. 파주 국제도시의 어느 지역에 가면 휴대폰이 먹통이라는 바로 그 소문이었다.  “어, 정말 휴대폰이 안 터진다!”분명 이 귀요미 승차 전에도 인스타그램에 새 글을 올렸다. 하지만 지금은 스마트폰으로 인터넷에 접속은 물론이고 통화도 불가능했다.   “학생들, 학생들은 지금 파주 국제도시의 맨틀 지역에 들어온 거야.”  “맨틀이요? 아저씨, 우리들이 땅 밑으로 들어왔어요?”  “보안유지 구역을 그렇게 부르지. 여기서는 아무것도 유출이 안 돼. 일반적인 견학 코스와는 달라.    평범한 거리 풍경을 휴대폰으로 찍는 것도 금지야.    이게 여러분이 모르던 진짜 파주 국제도시의 민낯이지.“우리는 휴대전화 카메라로 촬영을 해보려 했다. 하지만 아무리 창 밖 풍경을 찍어대도 휴대폰에 저장조차 되지 않았다.   “헛수고야. 여기는 로그아웃월드거든.”  “로그아웃월드요?”우리가 물었다.  “로그인 된 세상에서 떨어져 나온 곳이니까.”  접기"
SF 김승옥,"P. 143~144  원인 불명의 질병으로 인한, 가려움증에 의한 / 이하루K9 구역에서는 종종 오래된 것들이 발견되곤 했다. 이를테면 책 같은 것이나 지우개, 연필, 비디오테이프와 그 테이프를 넣고 볼 수 있는 기계 같은 것. 지금은 사용하지 않는 구시대의 유물들. 윤은 그런 것들을 주워 집으로 돌아가는 일이 잦았다. 수가 좋아하기 때문이다. 수는 그런 것들이 아날로그적인 것이라고 했다. 윤에게는 낯선 단어였다. 인공 생식의 시대로 접어들면서 모든 자치 정부가 금지한 말들 중 하나임이 분명했다. 지금은 사어가 된 말을 수가 어디서 들어 알고 있는지 신기했다. 설명을 요구하는 윤에게 수는 잠시 생각하더니 귀찮은 것이라고 말해주었다. 귀찮은 것이라고 말하는 수의 얼굴은 지는 해를 바라볼 때와 비슷했다. 윤은 아날로그라는 단어의 어감이 무척 듣기 좋아 고개를 끄덕이고 말았다. 아날로그 적인 것들은 대게 상처투성이였다.  접기"
SF 김승옥,"P. 195  아빠는 오늘을 좋아합니다 / 강병융2020년 이후에 태어난 사람들에게 디파이 이전 세상은 존재하지 않았다. 그래서 그들에게 그 이전 세상은 거리를 걷는 일처럼 전혀 중요한 것이 아니었다. 하지만 그 이전에 태어난 사람들은 두 부류로 나뉘기 시작했다. 아빠도 그 중 하나를 선택해야 했다. 아빠는 그 분류를 ‘사람을 만나본 사람’과 ‘그렇지 않은 사람’으로 구분하는 것 같다고 했다. 그렇게 디파이가 만든 새로운 세계에 빠르게 익숙해지는 사람들과 그것에 저항하는 사람들로 나위었다. 하지만 두 부류 모두에게 힘겨운 일이었다. 두 부류 모두에게 필요한 것들이 하나 둘 씩 만들어지기 시작했다. 그 중 하나가 ‘오늘’이었다.내가 선택한 날로 갈 수 있는 프로그램. 그 프로그램은 무균의 방에 설치되었다. 내가 되살리고 싶은 날을 다시 소환하는 프로그램이 ‘오늘’이다. 내가 정한 ‘오늘’을 살게 해주는 가상현실 프로그램. 깨끗하고 안전한 방에서 ‘오늘’을 즐길 수 있는 날이 온 것이다. 비대면의 세상에서 누릴 수 있는 대면의 세상. 진짜 만나지도 않았으면서, 진짜 만났다고 믿게 해주는 동시에, 영원히 진짜 만나는 것은 불가능하다는 사실을 일깨워주는 프로그램이 ‘오늘’이다.  접기"
SF 김승옥,"P. 207  가라아게 금지령 / 김민정  “가, 가, 가라아게 세?”리가 근무하는 편집부 부원들 모두 이마를 찡그리고 헉 하고 뱉었다. 섹시한 국제 리더 3위에 꼽힌 그는 ‘가라아게 세’를 도입한다고 했다.  “설탕세도 아니고 기름 세네.”소마가 말했다.‘가라아게’란 닭튀김을 말하는 일본어다. 비만 인구가 증가하는 나라들 중에는 설탕이 많이 들어간 음식에 특별한 세금을 붙이는 곳도 있다고 하는데, 일본도 결국 칼을 빼들었다. 그것도 닭튀김에 특별세금을 붙이겠다는 것이다. 일본으로 건너온 한국인들 중에는 치킨 가게를 하는 사람들이 많았다. 결국 이 정책은 한 민족에 대한 도전처럼 느껴졌다. 치킨 한 조각에 앞으로 35%의 세금이 붙게 된다. 1년 후인 2026년에는 가라아게 자숙령, 3년 후인 2028년에는 가라아게 금지령까지 내려질지 모른다고 언론들은 앞 다투어 보도했다.   <서민 음식 치킨, 부유층의 전유물로>  <정부의 음모? 운동할 여유 있는 층만 치킨을 먹어라!>  <밀가루 판매량 폭증, 이젠 집에서 만든다!>  <치킨 맛있게 튀기는 법 10가지>하지만 이 소동은 이렇게 끝나지 않았다.  접기"
SF 김승옥,"P. 270  어머니를 이해하기 위하여 / 전혜진어머니는 무진의 여기저기를 돌아보고 구석구석 꼼꼼히 살폈다. 아버지가 장차 살게 될 이곳이 혹시라도 불편하지 않을까, 부족한 점이 있지는 않을까 걱정하는 눈치였다. 괜찮을 거예요. 나는 속삭였다. 사실은 이렇게 공을 들여 만든 세계라 한들, 아버지에게 무슨 소용일까. 제대로 된 의식이 있을지, 그 안에서 좋아하던 책이며 논문이며 실컷 읽으며 지낼 수 있을지, 아무 기약도 없는 상태다. 언어를 인식하고 있는 지도, 그렇게 집착하고 미워하던 우리를 기억하고 있는지도 알 수가 없다. 기억한다 한들, 이 세계에서는 다시 말을 할 수 있다 한들, 왜 사람을 곱게 죽이지 않고 이런 곳에 가두어 놓았느냐고 호통이나 치지 않으면 다행이다. 그런 사람을 위해 만든 감옥을 바라보다가 어머니는 문득 말했다.  “세상에서 제일 먼저 편지를 쓴 사람은 어떤 사람이었을까요?”나는 그 말이 <무진기행>에 나오는 대사였다는 것을 뒤늦게 기억해냈다. 내가 만들어낸 그 가상 세계 속에서, 어머니가 앞으로 이 세계에서 살아가야 할, 아직은 우리 세계에 살아있는 당신의 남편을 향해, 이 세상에서 제일 먼저 쓰여질 편지를 쓰기 시작한 그 순간에.  접기"
SF 김승옥,"P. 294~295  야행 다시 만들기 / 곽재식현주는 아예 자신은 손을 대지 않고 처음부터 끝까지 컴퓨터 인공지능이 혼자서 소설을 영화로 만들어버리면 어떻게 될지 궁금했다. 사실 요즘은 많은 사람들이 공개용 프로그램으로 그런 장난을 치면서 논다. 읽기 귀찮은 소설이 있을 때, 자기가 좋아하는 영화배우의 자료 상품을 구입해서 입력시킨 후에 버튼 하나만 누르면 그 영화배우가 소설 주인공으로 나오는 영화의 영상을 컴퓨터가 최대한 그럴 듯하게 자동으로 만들어주는 소프트웨어가 나와 있다. 나이 든 사람들 중에는 그렇게 해서는 소설 읽는 즐거움을 제대로 누릴 수 없다고 한탄하는 이들도 있다. 하지만 그런 프로그램들 덕분에 훨씬 더 많은 사람들이 제목만 유명하던 옛 고전들의 이야기를 알게 되었다. 그렇게 완전히 컴퓨터 인공지능이 자동으로 영화를 만들어버린 결과를 보면 현주 같은 사람들이 직접 세심하게 조절해가며 만든 영화보다는 어색한 장면이 훨씬 많기는 하다. 그렇지만, 과연 그 차이가 그렇게 큰 것인지에 대해서는 사람마다 의견이 다르다. 인공지능이 최대한 공을 들여 가장 그럴싸하게 꾸민 영상의 차이는 어느 정도일까? 혹시 전자레인지 팝콘과 5성급 식당 일류 요리사가 정성을 다해 최고급 팬 위에서 튀겨낸 팝콘의 차이 정도는 아닐까?  접기"
들어본 이야기,P. 27  한 번만 시범을 보여주어 입력을 가하면 허공에서 균형을 유지하기 위한 최적의 값을 스스로 찾고 정확한 출력을 내놓는 몸. 무한의 몸. 단장은 소여를 돌보는 것만은 누구에게도 맡기지 않고 자신이 직접 태엽을 감았다…… 감았을 것이다. 우리에게는 그 모습을 보여준 적 없다.
들어본 이야기,"P. 78~79  차라리 자신이 딸이었다면, 모든 걸 희생하고 차별받고 살아온 그런 존재였다면 오숙처럼 무섭게 돌변할 기회라도 있었으련만, 그는 한없이 억울했다. 당장이라도 어머니에게 전화를 걸어 어머니만 그런 게 아니라 자신도 어머니를 닮아 도무지 잠을 잘 수가 없다고, 자신이 오숙처럼 되기를 바라느냐고, 앞으로 자기가 희생하고 살면 되겠느냐고 따져 묻고 싶었다.  접기"
들어본 이야기,P. 93~94  너는 지미 첸과 함께 여행자용 지도를 들고 호텔 밖으로 나와. 드디어 넌 맨정신으로 어제 도착한 도시를 봐. 낯선 문자가 그려진 간판을 걸고 있는 신식 건물들과 그 사이를 분주하게 지나가는 표정 없는 동양인들의 행렬. 넌 마치 걸리버가 된 기분이야. 정상성이 뒤집혔어. 너는 여기서 낯선 짐승이야.
들어본 이야기,P. 123  언젠가 했던 결심 같은 것은 몸이라는 기계 어딘가에 입력이 돼서 어떤 식의 작용으로 머릿속에서 울리게 되어 있나 봐 하는 생각이 들었다. 혹은 저 사람을 피해 얼른 뛰어가 너는 말을 해 너는 울면 안 돼 같은 즉각적인 경고를 들을 때도 있었다.
들어본 이야기,P. 179  고양이는 여전히 우리를 바라보고 있다. 우리는 쾌락에 가까운 해방감을 느끼며 우리의 신체에서 영원히 멀어질 것이다.
내일의 연인들,"P. 11  하지만 희망이란 때때로 멀쩡하던 사람까지 절망에 빠뜨리곤 하지 않나? 아니, 오로지 희망만이 인간을 나락으로 떨어뜨릴 수 있다. 게다가 희망은 사람을 좀 질리게 하는 면이 있는데, 우리는 대체로 그런 탐스러워 보이는 어떤 것들 때문에 자주 진이 빠지고 영혼의 바닥을 보게 되고 회한의 수렁에 빠지게 된다._ 「우리들」에서"
내일의 연인들,"P. 35  매해 여름이란, 이런 아름다운 계절이 한 번도 아니고 두 번도 아니라 셀 수 없이 많이 지속될 여름이란 우리가 감당하기에는 너무나 아득하고 눈부신 말이었다._ 「우리들」에서"
내일의 연인들,P. 37  “이제 해방촌이 낯설게만 보여. 그리고 그만큼 현수도 낯설어 보여. 단 며칠 사이에. 이상하지?”“그곳에서 우리가 가장 많이 한 말이 뭔지 알아? 사랑한다는 말이었어.”“아마 다시는 그 말을 할 수 없으리란 걸 알았기 때문이었겠지.”“그렇다면 그 말은 뭘까?”“다시는 할 수 없는 말.”“다시는 말할 수 없는 사랑이란 말은 뭘까?”_ 「우리들」에서  접기
