탑승을 시작하겠습니다,"P. 219~220  강가가 훤히 보이는 전망 좋은 카페에 앉아서 차를 마셨다. 붉었다가 노랬다가 팥죽색이었다가 하는 노을을 보고 있으니, 이제 정말 여행 막바지구나 싶었다. 개도 그걸 아는지 아니면 강바람이 선선하게 콧잔등을 간질여서인지, 눈을 게슴츠레 뜨고 노을을 바라보았다. 좋다. 좋구나. 여행은 좋은 거구나. 이 순간에 이런 걸 보려고 여행을 오는 거구나.  접기"
탑승을 시작하겠습니다,"P. 240~241  이환은 사람들이 그 위험천만한 상황에 왜 돈과 시간을 들여 스스로를 놓이게 하는지 도통 이해가 되지 않았다. 강도를 겪고 비행기를 놓치고 교통사고를 당하고 사기꾼을 만나고……. 하지만 시간이 지나자 거부감만큼이나 호기심이 생긴 것도 사실이다. 어떤 이들은 살아온 인생을 뒤엎을 만한 계기를 얻기도 하고, 잊었던 설렘과 흥분을 느끼기도, 순수한 환희를 체험하기도 했다. 그런 장면을 마주한 날이면 이환에게도 그 감정이 전염되어 커피를 서너 잔 연달아 마신 듯 심장이 뛰어 밤새 뒤척거렸다. 책을 읽다 만족스러운 결말을 보고 눈시울이 핑 도는 것처럼, 오랫동안 깨지 못한 게임을 시원하게 클리어한 것처럼 쾌감을 느끼는 날도 있었다.  접기"
다정한 유전,P. 17  서로를 돌보는 것은 우리의 일이 아니다. 하지만 고통은 함께 경험한다. 공교롭게도 우리는 그렇게 연결되어 있다. 그것이 우리의 삶이다.
다정한 유전,P. 70  내가 너희 글을 읽는 건…… 모르겠어. 그 세계들이 만나는 일 같다고 느껴졌어. 어떤 질문을 받은 것 같았지. 그렇다면 나는 어떻게 대답해야 할까.
다정한 유전,"P. 72  너무 내 것이라서 있는 그대로 느껴지는 어떤 마음 때문에, 나는 너희의 글을 제대로 읽을 수 없었어. 하지만 그것이 지금의 내 마음이라면, 나는 이걸 있는 그대로 써야 한다고 생각했어. 이 방식으로 우리가, 몰랐던 마음들이 만난다면, 그것으로 나는 새로운 것을 알 수 있게 되겠지."
다정한 유전,"P. 108  이상하게도 낫기 위해 노력한다는 건, 더 자주 끝을 생각하게 만들었다. 오히려 죽음을 향해 걸어간다는 생각도 들었다. 어떤 희망과 의지를 붙잡고 걸어가고는 있지만 사실 끝에는 무엇도 없고, 달라지는 건 없다는 걸 확인하는 일인지도 모른다는 예감."
다정한 유전,"P. 137  누군가를 미워하는 마음. 복수를 다짐하는 마음. 나를 이해하고 싶은 마음. 누군가를 그리워하고, 사랑하고, 질투하고, 원하는 마음. 그럼에도 불구하고 함께 있고 싶은 마음."
다정한 유전,P. 138  운명이 뒤집힌 그 이야기 속에서 글을 쓰는 건 내가 아니라 그녀다. 어딘가에서 벗어나기 위해 애쓰는 소녀. 엄마. 친구. 할머니. 내가 아닌 모든 사람들. 나는 그들을 통해 살아 있다.
다정한 유전,"P. 142  누군가와 50년간 친구로 지낸다는 건 뭘까. 그건, 어떤 마음으로 서로를 바라보게 할까."
다정한 유전,P. 146  내 친구에게 배운 방법이다. 친구는 괴로울 때마다 마음을 기록했다. 그리고 아무에게도 보여주지 않았다. 자신만의 마음을 간직했다는 생각 덕분에 견딜 만해진다고 했다.
다정한 유전,"P. 146  억울하고 분할 때마다 나는 글을 썼다. 내가 작가여서가 아니다. 내 친구에게 배운 방법이다. 친구는 괴로울 때마다 마음을 기록했다. 그리고 아무도에게도 보여주지 않았다. 자신만의 마음을 간직했다는 생각 덕분에 견딜 만해진다고 했다. 누구에게 맡겨놓은 마음이 아니니까. 그렇게 평안을 찾고 난 후, 그녀는 자긴의 사랑을 향해 돌아가곤 했다. 천천히, 그러나 흔들리지 않는 마음으로.  접기 -  밍밍"
다정한 유전,"P. 38  사사로운 감정에 얽매이고 사람들에게 마음을 열기 시작하면 앞으로 나아갈 수 없을 것 같았다. 이곳에 애정을 품고 아쉬워하기 시작하는 순간 마음이 약해질 것이고, 겁을 먹을 것이다. 돌아올 곳이 있다는 생각 때문에 느슨하게 살게 될 것이다. -  임은비"
우리의 정류장과 필사의 밤,"P. 9~10  계절이 변하는 걸 절감할 때마다 나는 그 사람을 떠올렸다. 잊으려고 한 적이 없었으니 떠오르는 거야 당연했고, 그때마다 그 사람이 몹시 보고 싶다는 걸 굳이 외면하지도 않았다. 그 사람을 사랑하지 않을 때가 없었다는 걸 뒤늦게 깨달았지만, 놀랍거나 새로울 것도 없었다. 서로에게는 늘 최선이었으므로 덜 사랑했다는 아쉬움도 없었다."
우리의 정류장과 필사의 밤,"P. 61~62  어느 순간, 어쩐지 나는 보통의 삶을 살 수 있는 사람이 아니라는 생각이 들었다. 보통의 사람들이 보통의 삶이라고 규정지은 것들, 학교와 직장과 적당한 수입, 가족을 일궈 안정적인 일상을 꾸리고, 노후를 준비하며 일생을 보내는 일련의 과정들.  그 과정을 영위하기 위한 현실적인 실천 의지 같은 것들. 그런 것에 흥미가 없었으므로 가지고 싶은 열망도 없었다. 일반적인 삶에 관심이 없다는 것을 인식하자, 그제야 가슴속에서 꿈틀거리는 것이 보였다.  접기"
우리의 정류장과 필사의 밤,"P. 63  나는 처음으로 내 안에서 자라고 있는 걸 밝혔다. 티끌보다 더 작은 것이 간신히 뿌리를 내리고, 안간힘으로 중력 반대 방향으로 고개를 쳐든 연하디연한 작은 싹과 같은 나의 희망에 대해서."
우리의 정류장과 필사의 밤,"P. 87~88  그날 밤 그 사람과 내가 함께 본 건 특별한 풍경은 아니었다. 맥주라도 한잔했는지 유쾌하게 웃으며 지나가는 무리들과 걷는 내내 통화를 하며 미소를 짓던 아가씨, 수줍게 팔짱을 끼고 종종걸음으로 사라졌던 교복 입은 어린 연인들과 쪼르르 줄지어 부지런히 제 갈 길을 가던 길고양이 네 마리."
우리의 정류장과 필사의 밤,"P. 116~117  그날 저녁, 엄마의 구시렁 소리를 무시한 채 그대로 출근한 아버지로부터 전화가 걸려왔다. 설거지 중이어서 물이 뚝뚝 떨어지는 손으로 전화를 받았다.- 인생은 길고, 넌 아직 피지 못한 꽃이다. 주저앉지 마. 엄마가 하란 대로 하지도 말고.그러곤 뚝, 통화가 끊겼다."
우리의 정류장과 필사의 밤,절대 돌아가지 않겠다는 다짐은 하지 않았다. 언제든지 다시 돌아갈 수 있다는 생각을 버린 적도 없다. 그러나 지금은 잠시만이라도 나는 나로 살고 싶었다.
우리의 정류장과 필사의 밤,"P. 57  나는 왜 하고 싶은 게 없는 아이였을까. 넉넉하지 않은 집의 장녀로 자랐으면 다른 세상으로나아가려는 욕망을 품었음 직도 한데, 그도 아니면 답답한 집을 떠나 혼자 살고 싶다는 생각을해봤을 법도 한데, 나는 그저 가만히 있는 걸 좋아하는 아이일 뿐이었다. 변화나 시끄러운 걸 좋아하지 않았고, 몸을 움직이는 놀이도 즐겨하지않았다. 집에 있던 많지 않은 책을 읽고 또 읽거나, 다 쓴 달력 뒷장에 빼곡하게 낙서를 하거나,반듯하게 누워 천장의 벽지 무늬를 눈으로 따라가며 상상하거나, 그도 아니면 창밖을 멍하게 바라보는걸 좋아했다.  접기 -  책방꽃방"
우리의 정류장과 필사의 밤,P. 9  계절이 변하는 걸 절감할 때마다 나는 그 사람을 떠올렸다. -  바람꽃
우리의 정류장과 필사의 밤,P. 59  나는 아무것도 하지 않는 사람으로 살아도 상관이 없었다. 아무여도 상관이 없었다. ˝ p59 -  바람꽃
우리의 정류장과 필사의 밤,"P. 66  ˝아무것도 하지 않는 것보다는 뭐든 시도해보는 게 의미 있다는 거, 이미 언니도 잘 알고 있잖아.해보고 안 되면 그때 말자. 그때 포기해도, 그때 다른 길을 찾아도 돼. ... -  바람꽃"
부다페스트 이야기,P. 28~29  48회 인터내셔널 데이 행사가 열리던 9월 마지막 수요일 아침의 하늘은 두꺼운 구름으로 뒤덮여 어둡고 무거워 보였으나 일기 예보와 달리 비를 뿌리지는 않았다. 예상치 못한 사건들 때문에 매년 곤욕을 치렀던 교사들은 미묘한 이상 징후에도 예민하게 반응하지 않을 수 없었다. 그들은 행사에 부정적인 영향을 미칠 수 있는 언행들을 최대한 자제했다. 두 달 동안의 노력이 행사 당일의 날씨 때문에 의미를 잃게 되는 경우를 상상하는 건 끔찍했다.―「프롤로그」에서  접기
부다페스트 이야기,P. 75  부다페스트의 유대인 회당 부근에서 작은 프랑스 식당을 운영하는 요리사는 어느 날 저녁 찾아온 손님들이 세인트버나드 국제 학교의 인터내셔널 데이 행사에 대해 이야기하는 것을 들었다. 부다페스트에서 성공한 자들만이 그 행사의 일일교사로 초대받는다는 사실에 흥미를 느낀 요리사는 이 손님들이 다시 자신의 가게에 나타나길 기다렸다가 평소보다 훨씬 공들여서 요리한 음식을 식탁까지 직접 들고 날랐다. 음식에 대한 평가를 기다리는 동안 그는 자신이 살아온 이야기를 간략하게 들려주었다. ―「요리사의 이야기」에서  접기
부다페스트 이야기,"P. 328  부자는 자신의 참여를 탐탁지 않게 여기는 자들이 학교 안팎에 많다는 사실을 잘 알고 있었기 때문에 그들의 주목을 끌지 않기 위해 행사 당일의 옷차림과 액세서리를 세심하게 선택했고, 강의 원고를 변호사와 함께 검토했으며, 고급 승용차를 지하철역에 세운 뒤 학교까지 걸어왔다.각별한 주의에도 교문 앞에서 교장이 그를 직접 맞이하는 바람에 그는 어쩔 수 없이 주목을 받았다. 교장실로 안내되는 것을 거부하고 일일교사 대기실로 곧바로 들어오긴 했으나 그를 알아본 교감이 급히 건넨 방석과 물수건, 커피를 무심결에 받아 들면서 모든 노력은 수포로 돌아갔다. ―「부자의 이야기」에서  접기"
아리랑 세트 - 전12권,"초록빛으로 가득한 들녘끝은 아슴하게 멀었다. 그 가이없이 넓은 들의 끝과 끝은 눈길이 닿지 않아 마치도 하늘이 그대로 내려앉은 듯싶었다. 그 푸르름 속에서 일하고 있는 사람들은 움직임을 느낄 수 없는 채 멀고 작은 점으로 찍혀 있었다. 그런데 그 넓은 들은 한낮의 생기를 잃고 야릇한 적요 속에 가라앉아 있었다. 초록빛 싱그러움을 뒤덮으며 들판에는 갯내음 짙은 바람이 불고 있었던 것이다.거칠게 휘도는 바람을 앞세우고 탁한 회색빛 구름이 바다 쪽에서 몰려오고 있었다. 시꺼먼 먹구름은 하늘을 금방금방 삼켰다. 그리고 그 두껍고 칙칙한 구름덩이들은 서로 얽히고설켜 꿈틀대고 뒤척이며 뭉클뭉클 커져가고 있었다. 순간순간 그 형상이 변하고 있는 먹구름은 무슨 살아 있는 괴물처럼 흉물스럽기도 했고, 무슨 액운을 품고 있는 것처럼 음산하기도 했다. -「역부의 길」 중에서  접기"
아리랑 세트 - 전12권,"“아니, 저 나무가 어찌 저리 생겼소?”“저것이 나무기는 나무요?”“허 참, 고것 요상허게도 생겼네. 털 다 뽑고 꽁지만 남은 달구새끼꼴 아니라고?”“참, 나무치고는 어지간히 못났네.”그건 바로 야자수였다.배가 부두에 가까워지면서 그들에게 눈선 것은 그 키 큰 나무만이 아니었다. 멀찍이 보이는 산 모양새며 나무숲도 눈설었고, 집들도 눈설었으며, 사람들과 그 차림새도 눈설었다. 그러다 보니 하늘도 눈설고 햇볕이며 바람까지도 눈설게 느껴졌다.그러나 그들은 착각을 일으키고 있는 것이 아니었다. 한반도와 기후가 다른 하와이는 하늘 색과 바다 색이 달랐으며, 햇볕의 강도나 바람의 감촉이 달랐고, 따라서 나무들 종류도 달라 숲 모양도 다를 수밖에 없었다. 그들의 눈이나 감각은 정확했던 것이다. -「이민이냐 노예냐」 중에서  접기"
아리랑 세트 - 전12권,"송수익은 갈피를 잡을 수 없는 마음으로 이틀을 서성거렸다. 가슴에서는 장지연의 글에서 받은 비분이 절망감으로 가라앉기도 하고 저항감으로 솟구치기도 하면서 끓고 있었다.송수익은 생각 끝에 신세호를 찾아가 보기로 했다. 정재규는 이미 말 상대가 아니었고 이런 경우에 서로 마음을 기댈 수 있는 것은 신세호였던 것이다. 그러나 신세호와 생각의 방향이 꼭 일치하는 것은 아니었다. 신세호는 전통적인 유생의 길을 지키려는 생각을 가지고 있었다. 그래서 그에게 단발 같은 것은 아예 용납되지 않았다.신세호는 초가의 사랑방에서 먹을 갈고 앉아 있었다.“어서 오시게, 수익이. 내가 자넬 찾아가 볼까 생각하고 있었는데 자네 발길이 더 빨랐네그려.”신세호는 약간 웃음지은 얼굴로 송수익을 예절 갖추어 맞아들였다.“그간 잘 지냈는가. 세속을 멀리하고 묵향 속에 묻힌 몸이라, 과시 선비다운 모습이로세. 무슨 글을 짓던 참인가?”송수익은 자리를 잡고 앉으며 벼루 쪽으로 눈길을 보냈다. 큼직한 벼루와 조그만 연적이 눈에 익었다. 방 안에는 먹내음이 그윽하게 담겨 있었다.-「우리 어찌 살거나」 중에서  접기"
태백산맥 세트 - 전10권,"정하섭은 두 손으로 얼굴을 꼭 눌러 감싸며 신음처럼 긴 숨을 내쉬었다. 그러면서, 밤새껏 걸어 여기까지 와 있지 않느냐고 스스로를 일깨우고 있었다. 그때 구원처럼 들리는 목소리가 있었다. “암호는 백두산, 한라산, 복창하시오.” “백두산, 한라산.” 지난밤 위원장에게 하달받은 암호가 정하섭의 가슴에 안도의 따스한 빛을 뿌리고 있었다. 암호는 곧 생명이었다. 암호의 누설은 조직의 동맥을 끊는 것이나 다름없었다. 자신에게 독립공작을 부여하고 암호까지 하달했다는 것은 당성을 의심하기는커녕 당성을 얼마나 신뢰하고 있는가 하는 좋은 반증이었던 것이다.“내가 너무 신경과민이군.”정하섭은 스스로를 안심시키듯 분명한 어조로 혼잣말을 하며 머리칼을 쓸어올렸다. 위원장은 사소한 실수로 야기될지 모를 큰 사고를 미연에 방지하고자 했던 것이다. 위원장다운 주도면밀한 조치였다. 그는 거의 웃는 일이 없이 냉혈적인 침착성을 가진 사람이었다. 그런데 그가 정하섭을 불렀을 때는 다소 당황한 빛을 감추지 못하고 있었다. “사태가 우리한테 약간 불리하게 전개되고 있소. 지금부터 내가 하는 말 똑똑히 들으시오. 이건 당의 명령이오.” 당의 명령이라는 전제 앞에서 정하섭은 반사적으로 부동자세를 취하며 긴장했다. 당의 명령은 ‘사태가 약간 불리한’ 정도가 아니었다. 자신들이 취해야 하는 행동은 결정적인 패주였던 것이다. 그러나 정하섭은 묵묵히 명령을 수령하는 자세를 지켰다. 명령 앞에서는 그 어떤 이의제기나 회의적 질문이 용납될 수 없다는 불문율 때문이 아니었다. 직감적으로 느끼기에도 자신들이 처한 상황은 너무나 급박해져 있었다.				              -「일출 없는 새벽」 중에서  접기"
태백산맥 세트 - 전10권,"스무 살 나이가 가까워질 임시부터였으니까 아들의 열 받친 행동거지는 일정(日政) 때부터 시작되어 이미 10년이 가까워 있었다. 일본인 지주한테 대항해서 소작쟁의를 벌이면서 아들은 가도가도 목마르고 허기진 소작농군의 길을 벗어나기 시작했다. 일반 소작쟁의도 삭신 녹아내릴 매타작에 콩밥신세가 확연한 죄로 정해진 세상에서, 일본인 지주를 상대로 한 소작쟁의가 어떤 결과를 부를지는 너무나 빤한 노릇이었다. 그것은 맨주먹으로 닛뽄도 휘두르는 순사한테 덤벼드는 것이나 진배없었고, 불구덩이 속으로 뛰어드는 성미 급한 나방이나 다를 바 없었다. 피걸레가 되어 내던져진 아들을 업고 집으로 돌아오며 판석 영감은 제 살이 찢겨나가는 아픔에 떨며 울었고, 차라리 죽지 못하고 살아 있는 목숨의 구차함이 비통해서 울었다. 축 늘어진 아들을 수십 번 추슬러 업어가며 판석 영감은 피물림하듯 대대로 이어진 소작농의 비애와 운명을 씹었다. 대를 물리는 가난이라는 것처럼 무서운 죄가 없었고, 견디기 어려운 벌이 없었다. 아들은 그 죄를 타고나서 이제 철든 나이가 되면서 그 벌을 받기 시작하고 있는 것이었다.“아부지, 지발 암 말도 마씨요. 목심 내걸고 독립운동허는 사람들도 있는디, 뺏긴 지 밥그럭 찾아묵는 일도 못헌다먼 고것이 무신 사내새끼다요. 그라고 우리가 허는 짓이 계란으로 바우 치기라는 것도 다 알고 있당께요. 그려도 허고 허고 또 혀야지라. 작인 없는 지주놈들도 웂는 법잉께요.”                                                 -「가슴으로 이어진 물줄기」 중에서  접기"
태백산맥 세트 - 전10권,"“범우, 빨리 피허게. 자네 춘부장 어르신은 몰라도 자네의 안전까지 내가 보장할 수는 없네. 자네한테 이런 말 미리 하는 것은 우정 때문이 아니네.”그날 밤 꼭 귀신처럼 느닷없이 나타난 염상진은 그 느닷없음과 똑같이 아무 설명 없이 이렇게 말했던 것이다. 김범우는 가슴이 쿵 무너지는 것과 동시에 그 말뜻을 알아차렸다. 공산당 활동이 불법화되면서 염상진은 체포되어 1년 형을 살고 나왔다. 그 다음부터는 잠잠하게 지내는 것 같았다. 그런데 금년 3월에 남한만의 단독정부 수립을 위한 선거 실시가 공포되고, 그 준비가 본격화되자 좌익계 반대폭동이 전국적으로 극렬하게 일어났다. 그때 염상진은 지하조직화되어 있던 부하들을 이끌고 경찰서를 습격했다. 그 실패로 7개월 동안 자취를 감추었던 그가 밤중에 느닷없이 나타난 것과, 그 말하는 품의 당당함으로 보아 일이 벌어져도 크게 벌어졌음을 직감할 수 있었다.“형님, 무슨 말이오. 앉어서 차근차근 좀 말해 보시오.”짐작만으로 될 일이 아니었다. 김범우는 염상진의 옷소매를 잡아끌었다.“나 그럴 시간이 없네. 간단하게 말해서, 마침내 혁명의 날이 왔네. 이번에는 먼젓번 같은 것이 아니라 군인들과 힘이 합쳐진 결정적인 것이네. 그쯤 알고 오늘 밤중으로 피하게. 내 말 우습게 알고 뭉기적이다가 체포되면 그땐 난 모르네. 이만 가네.”-「민족의 발견」 중에서  접기"
쓰지 않을 이야기,"P. 50  나는 그토록 서글픈, 그토록 참담한 푸른빛을 본 적이 없었다. -  겨울의 눈"
쓰지 않을 이야기,P. 20  최근에 깨달은 나의 가장 큰 장점은 질기다는 거였다. 강하기보다는 질긴 것. 어쩌면 강한 것과 질긴 것 중 살아가는 데 더 필요한 건 질긴 것인지도 몰랐다. -  vega23
쓰지 않을 이야기,"P. 64  “엄마, 아들한테는 이런 거 대놓고 해달라고 못하죠? 왜 마스크 구해 드리는 건 딸이니 며느리여야 해요?”“상진이 갸는 지금 바쁘다 아이가, 당장 시험이 코 앞인데.”상희가 쿄웃음을 쳤다. -  vega23"
쓰지 않을 이야기,"P. 88  휴대전화를 쥔 일남의 손이 덜덜 떨렸다 .보이스피싱으로 돈 보내달라 카는 사기꾼들 이야기는 들어 봤어도, 열 살짜리 가스나 알몸 사진이 와 필요하다 카노, 이거는 듣도 보도 못한 기라. 숭악한 놈들, 고얀 놈들. -  vega23"
쓰지 않을 이야기,"P. 88  “근데 엄마가요. 이 사진 우리끼리 비밀이라고 했는데, 엄마 말 안 들으면 학교 친구들한테도 사진 다 보이줄 꺼라고. 우리 학교 홈페이지에 올린다고 했어요. 우리 집 주소도 다 알고 있다 했는데.” -  vega23"
마음이 쉬어가는 곳 : 벙커,P. 15  밖을 헤매다 집으로 돌아온 건 새벽 1시가 다 되어서였다.그런데 현관문이 열리지 않는다. 현관 비밀번호가 바뀌어 있었다. 덜컥덜컥 문을 잡아당기는 소리가 들릴 텐데도 아무도 나와 보지 않는다. 마치 나란 인간이 이 철문 안의 사람들에게 아무런 의미가 없는 존재인 것처럼.다시 엘리베이터를 타고 버튼을 누르려는데 갑자기 가슴이 먹먹해졌다. 나는 갈 곳이 없다. 25층 아파트 어디에도 내가 갈 곳은 없다.  접기
마음이 쉬어가는 곳 : 벙커,"P. 12  나 역시 녀석이 쌓아 올린 견고한 담벼락 안을 들여다보는 일 따위에 힘을 쏟기보다 덮어놓고 나쁜 새끼라고 생각하는 쪽이 편했다. 녀석이 왜 그런 폭력적인 아이가 되었는지 그 이유 따위는 알고 싶지도, 이해하고 싶지도 않았다."
마음이 쉬어가는 곳 : 벙커,"P. 18  “애들이 널 무서워한다고 생각하지? 웃기지 마. 무서워하는 게 아니라 널 싫어하는 거야.”“닥쳐라!”“김하균, 너 집에서 두들겨 맞고 다닌다며?”“닥쳐!”“네 아빠가 개 패듯이 팬다며!”“닥치라고!”"
마음이 쉬어가는 곳 : 벙커,P. 20~21  교실은 폭풍 전야처럼 고요했다. 분위기를 감지한 여자아이들 몇몇이 밖으로 나가자 4분단 앞뒤에 있던 두 아이가 문을 닫고 몸으로 입구를 막아섰다. 아무도 동의하지 않았지만 아무도 반대하지 않는 이상한 모의가 시작되었다. 등골이 서늘해졌다.
마음이 쉬어가는 곳 : 벙커,"P. 37~38  심호흡을 하고 물속으로 들어가 다리 근처를 살피던 그때, 반대편 강둑 가까이에서 깜빡이는 오렌지색 불빛이 다시 나타났다. 마치 그 오렌지색 불빛이 내게 그곳으로 오라고 손짓하는 것처럼 느껴졌다. 나는 바다 요정 세이렌에게 홀린 듯 그 불빛을 향해 나아갔다. 곧 눈앞에 커다란 시멘트 기둥이 나타났다. 강물 속에 잠겨 있는 한강 교각의 아랫부분이었는데 신기하게도 그 중앙에 사람이 드나들 수 있는 출입문이 나 있었다. 마치 누군가가 일부러 만들어 놓은 듯 네모반듯한 모양의 완전한 직사각형 문이었다.  접기"
마음이 쉬어가는 곳 : 벙커,P. 110  아버지의 삶이야말로 그 불쌍한 불쏘시개 인생 아닐까?마음이 먹먹하다. 불쏘시개의 아들 역시 불쏘시개일 뿐이라서. 나도 뭔가를 태울 만큼 열정적인 삶을 살 것 같지 않아서. 내 인생이 활활 타오르기도 전에 재가 되어 고꾸라질 것 같다.
마음이 쉬어가는 곳 : 벙커,P. 121  녀석은 마치 누군가가 자신의 하루를 그쯤에서 끝내 주기를 바라기라도 하듯 일부러 그런 짓을 저질렀던 것인지도 모른다. 자신에게 다가온 불행을 일부러 벌집 쑤시듯 헤집고 터뜨려 끝을 보려고 했던 걸지도……. 녀석은 엄마가 내민 그 봉투를 집을 떠나라는 의미로 받아들였던 게 분명했다. 더 이상 희망이 없다고 느꼈을지도 모른다. 결국 일기를 들여다보고 녀석의 진심을 알게 되어 버렸다.  접기
마음이 쉬어가는 곳 : 벙커,P. 188  메시의 고함 소리에 벽이 흔들리며 형광등이 깜빡였다. 그사이 미노는 의식을 잃고 바닥에 쓰러졌고 벙커의 벽은 마치 살아 숨 쉬듯 꿈틀대기 시작했다. 지진이라도 난 것처럼 벙커가 크게 휘청대는 그 순간 2층 해치까지 왈칵 강물이 솟구쳐 올랐다. 왈칵왈칵 피를 토하듯 해치가 강물을 뿜어 대자 벙커가 형체를 잃고 더 크게 흔들리기 시작했다. 상처가 난 벙커의 벽면이 꼭 사람의 생살같이 퉁퉁 부어오르며 벌겋게 피를 흘리는 광경을 보는 순간 섬뜩한 느낌이 들었다.  접기
마음이 쉬어가는 곳 : 벙커,"P. 106  엄마는 늘 사람 사는 게 다 거기서 거기라고 하지 않았나.뚜껑을 열어보면 집집마다 골치 아픈 일 한두 가지쯤 짊어지고 사는 거라고 했다. 우리 집만 이렇게 정나미 뚝뚝 떨어지고 콩가루 날리며 사는 건 아니라고, 어느 집에나 집어 던져 박살이 난 물건 하나쯤은 있는 거라고 믿고 살아왔다. 가끔씩 들려오는 윗집 말다툼 소리에 마음이 편해질 때도 있었다. 그런데 우윤석의 문자를 보는 순간 속이 쓰리다 못해 아팠다. 치열 교정기를 끼고 늘 입가에 거품을 물고 있는 그 녀석이 부럽기까지 했다.  접기"
